<?xml version="1.0" encoding="UTF-8"?>
<article xmlns:xi="http://www.w3.org/2001/XInclude"
         xmlns:xsi="http://www.w3.org/2001/XMLSchema-instance"
         xsi:noNamespaceSchemaLocation="../../../../docs.xsd"
         id="get---db-">
   <title>GET /{db}</title>
   <description>TODO: Add description.</description>
   <introduction>
      <paragraph>This request retrieves information about a database.</paragraph>
   </introduction>
   <topics>
      <topic id="request">
         <title>Request</title>
         <body>
            <paragraph>
               <strong>Request headers</strong>
            </paragraph>
            <paragraph>This request does not have any required headers.</paragraph>
            <paragraph>
               <strong>Query parameters</strong>
            </paragraph>
            <paragraph>This request does not use query parameters.</paragraph>
            <paragraph>
               <strong>Message body</strong>
            </paragraph>
            <paragraph>This request does not use a message body.</paragraph>
         </body>
      </topic>
      <topic id="response">
         <title>Response</title>
         <body>
            <paragraph>
               <strong>Status codes</strong>
            </paragraph>
            <unordered-list>
               <list-item>200 OK – Request completed successfully</list-item>
               <list-item>404 Not Found – Requested database not found</list-item>
            </unordered-list>
            <paragraph>
               <strong>Response headers</strong>
            </paragraph>
            <paragraph>This response uses only standard HTTP headers.</paragraph>
            <paragraph>
               <strong>Message body</strong>
            </paragraph>
            <paragraph>The message body is a JSON document that contains the following objects:</paragraph>
            <paragraph>| Name | Type |Description |</paragraph>
         </body>
      </topic>
   </topics>
</article>
