<?xml version="1.0" encoding="UTF-8"?>
<article xmlns:xi="http://www.w3.org/2001/XInclude"
         xmlns:xsi="http://www.w3.org/2001/XMLSchema-instance"
         xsi:noNamespaceSchemaLocation="../../../../../docs.xsd"
         id="adding-source-files-to-your-project">
   <title>Adding Source Files to Your Project</title>
   <description>TODO: Add description.</description>
   <introduction>
      <paragraph>If you need to debug Couchbase Lite, you can include the Couchbase Lite code in your project rather than using a JAR file or the Maven artifact dependencies. If you choose to add the source files, make sure you remove any Maven or JAR file dependencies that you used previously.</paragraph>
      <paragraph>Follow these steps to add Couchbase Lite source files directly to your project:</paragraph>
   </introduction>
   <topics>
      <topic id="add-submodules">
         <title>Add submodules</title>
         <body>
            <ordered-list>
               <list-item>
                  <paragraph>Change to the parent <strong>MyProject</strong> directory, which contains the <strong>settings.gradle</strong> file.</paragraph>

                  <code-block>
$ cd MyProject 
</code-block>
               </list-item>
               <list-item>
                  <paragraph>Add the required submodule:</paragraph>

                  <code-block>
$ git submodule add https://github.com/couchbase/couchbase-lite-android-core.git CBLite
</code-block>
               </list-item>
               <list-item>
                  <paragraph>Add any optional submodules that you need:</paragraph>

                  <code-block>
$ git submodule add https://github.com/couchbase/couchbase-lite-android-listener.git CBLiteListener
$ git submodule add https://github.com/couchbase/couchbase-lite-android-javascript.git CBLiteJavascript
</code-block>
               </list-item>
            </ordered-list>
         </body>
      </topic>
      <topic id="update-gradle-files">
         <title>Update Gradle files</title>
         <body>
            <ordered-list>
               <list-item>
                  <paragraph>Add the following line to the <strong>settings.gradle</strong> file:</paragraph>

                  <code-block>
include ':MyProject', ':CBLite'
</code-block>
               </list-item>
               <list-item>
                  <paragraph>If you included any optional submodules, add include statements for them to the <strong>settings.gradle</strong> file.</paragraph>
               </list-item>
               <list-item>
                  <paragraph>Add the following dependency to the <strong>MyProject/MyProject/build.gradle</strong> file:</paragraph>

                  <code-block>
dependencies {
    ... existing dependencies ...
    compile project(':CBLite')
</code-block>

                  <paragraph>}</paragraph>
               </list-item>
               <list-item>
                  <paragraph>If you included any optional submodules, add compile statements for them to the <strong>MyProject/MyProject/build.gradle</strong> file.</paragraph>
               </list-item>
            </ordered-list>
         </body>
      </topic>
   </topics>
</article>
